{
  "$schema": "http://json-schema.org/draft-04/schema#",
  "type": "object",
  "properties": {
    "status": {
      "type": "integer"
    },
    "message": {
      "type": "string"
    },
    "pagination": {
      "type": "object",
      "properties": {
        "pages": {
          "type": "integer"
        },
        "per_page": {
          "type": "integer"
        },
        "page_count": {
          "type": "integer"
        },
        "total_count": {
          "type": "integer"
        },
        "links": {
          "type": "object",
          "properties": {
            "first": {
              "type": "string"
            },
            "previous": {
              "type": "string"
            },
            "current": {
              "type": "string"
            },
            "next": {
              "type": "string"
            }
          },
          "required": [
            "first",
            "previous",
            "current",
            "next"
          ]
        }
      },
      "required": [
        "pages",
        "per_page",
        "page_count",
        "total_count",
        "links"
      ]
    },
    "data": {
      "type": "array",
      "items": [
        {
          "type": "object",
          "properties": {
            "id": {
              "type": "integer"
            },
            "name": {
              "type": "string"
            },
            "users": {
              "type": "array",
              "items": [
                {
                  "type": "object",
                  "properties": {
                    "id": {
                      "type": "integer"
                    },
                    "email": {
                      "type": "string"
                    },
                    "first_name": {
                      "type": "string"
                    },
                    "last_name": {
                      "type": "string"
                    }
                  },
                  "required": [
                    "id",
                    "email",
                    "first_name",
                    "last_name"
                  ]
                },
                {
                  "type": "object",
                  "properties": {
                    "id": {
                      "type": "integer"
                    },
                    "email": {
                      "type": "string"
                    },
                    "first_name": {
                      "type": "string"
                    },
                    "last_name": {
                      "type": "string"
                    }
                  },
                  "required": [
                    "id",
                    "email",
                    "first_name",
                    "last_name"
                  ]
                }
              ]
            }
          },
          "required": [
            "id",
            "name",
            "users"
          ]
        }
      ]
    }
  },
  "required": [
    "status",
    "message",
    "pagination",
    "data"
  ]
}