{
    "status": 200,
    "message": "",
    "pagination": {
        "pages": 1,
        "per_page": 25,
        "page_count": 1,
        "total_count": 2,
        "links": {
            "first": "http://api-dev-eproc.gokomodo.co/v1/api/master/departments?page=1",
            "previous": "",
            "current": "http://api-dev-eproc.gokomodo.co/v1/api/master/departments?page=1",
            "next": ""
        }
    },
    "data": [
        {
            "id": 284,
            "name": "Procurement Audit",
            "users": [
                {
                    "id": 2994,
                    "email": "day6corp@day6.co",
                    "first_name": "Day",
                    "last_name": "Six"
                },
                {
                    "id": 3047,
                    "email": "day602@mail.co",
                    "first_name": "Dinda ",
                    "last_name": "Kiranaa"
                },
                {
                    "id": 3048,
                    "email": "day603@mail.co",
                    "first_name": "Denia ",
                    "last_name": "Aditamaa"
                },
                {
                    "id": 3050,
                    "email": "day605@mail.co",
                    "first_name": "Dodi ",
                    "last_name": "Budianto"
                },
                {
                    "id": 3190,
                    "email": "day6hop@mail.com",
                    "first_name": "Day6",
                    "last_name": "HOP"
                },
                {
                    "id": 3192,
                    "email": "day6staff@mail.com",
                    "first_name": "Day 6",
                    "last_name": "Staff"
                }
            ]
        },
        {
            "id": 283,
            "name": "Departemen Procurement",
            "users": [
                {
                    "id": 2994,
                    "email": "day6corp@day6.co",
                    "first_name": "Day",
                    "last_name": "Six"
                },
                {
                    "id": 3046,
                    "email": "day601@mail.co",
                    "first_name": "Dayat ",
                    "last_name": "Pilang "
                },
                {
                    "id": 3047,
                    "email": "day602@mail.co",
                    "first_name": "Dinda ",
                    "last_name": "Kiranaa"
                },
                {
                    "id": 3049,
                    "email": "day604@mail.co",
                    "first_name": "Daniel ",
                    "last_name": "Sosiawan"
                },
                {
                    "id": 3191,
                    "email": "day6manager@mail.com",
                    "first_name": "Day 6",
                    "last_name": "Manager"
                }
            ]
        }
    ]
}